<?xml version="1.0" encoding="UTF-8"?>
<partsCatalog xmlns:xsi="http://www.w3.org/2001/XMLSchema-instance"
  xsi:noNamespaceSchemaLocation="partsCatalogMultiFieldIds.xsd">

  <parts>

    <part id="121">
      <name>Screw</name>
      <price>12.40</price>
      <manufacturer>8</manufacturer>
    </part>

    <part id="121">
      <name>Nut</name>
      <price>4.40</price>
      <manufacturer>9</manufacturer>
    </part>

    <part id="122">
      <name>Bolt</name>
      <price>4.40</price>
      <manufacturer>7</manufacturer>
    </part>

  </parts>

  <manufacturers>

    <manufacturer id="7">
      <name>Screw Loose</name>
    </manufacturer>

    <manufacturer id="8">
      <name>Screws Loose</name>
    </manufacturer>

  </manufacturers>
</partsCatalog>
